{
  "paymentId": "018f47f2-bd77-7d62-a90e-8e276d5608e9",
  "previousAttemptId": "018f47f2-bd77-7d62-a90e-8e276d5608e8",
  "providerEvidenceId": "018f47f2-bd77-7d62-a90e-8e276d5608ea",
  "providerId": "SIMULATOR",
  "requestedAt": "2026-07-21T03:00:00Z",
  "retryRequestId": "018f47f2-bd77-7d62-a90e-8e276d5608eb"
}
